year,geo_name,geo,soc_name,soc,avg_wage,avg_wage_moe
2014,"Huntsville City (Far West & Southwest) PUMA, AL","79500US0100200","Computer programmers","151131",91997.0,27824.9
2014,"Huntsville (North) & Madison (East) Cities PUMA","79500US0100301","Computer programmers","151131",88737.2,10281.7
2014,"Huntsville City (Central & South) PUMA","79500US0100302","Computer programmers","151131",81644.8,33717.9
2014,"DeKalb & Jackson Counties PUMA","79500US0100400","Computer programmers","151131",31703.7,26379.8
2014,"Marshall & Madison (Southeast) Counties--Huntsville City (Far Southeast) PUMA","79500US0100500","Computer programmers","151131",69876.0,48010.8
2014,"Decatur City PUMA, AL","79500US0100600","Computer programmers","151131",56301.2,25144.2
2014,"St. Clair & Blount Counties PUMA, AL","79500US0100800","Computer programmers","151131",61799.9,9192.8
2014,"Calhoun County PUMA","79500US0101100","Computer programmers","151131",97753.3,21970.4
2014,"Shelby County PUMA, AL","79500US0101200","Computer programmers","151131",85287.0,5153.11
2014,"Hoover (North), Vestavia Hills & Homewood Cities PUMA, AL","79500US0101303","Computer programmers","151131",85446.3,8892.02
2014,"Trussville, Center Point & Gardendale Cities PUMA, AL","79500US0101304","Computer programmers","151131",76884.2,8637.68
2014,"Tuscaloosa (Outer) & Pickens Counties--Northport City (North & West) PUMA","79500US0101500","Computer programmers","151131",77491.3,15699.0
2014,"Chilton, Tallapoosa, Chambers & Coosa Counties PUMA","79500US0101800","Computer programmers","151131",69350.6,11704.6
2014,"Auburn City PUMA, AL","79500US0101900","Computer programmers","151131",59058.3,19735.5
2014,"Montgomery City & Pike Road Town (North) PUMA, AL","79500US0102000","Computer programmers","151131",53404.6,9054.69
2014,"Elmore, Autauga, Montgomery (Outer) & Lowndes Counties PUMA, AL","79500US0102100","Computer programmers","151131",68400.4,12806.6
2014,"Coffee, Covington, Butler & Crenshaw Counties PUMA","79500US0102300","Computer programmers","151131",55761.0,2871.96
2014,"Dothan City PUMA, AL","79500US0102500","Computer programmers","151131",44454.0,12393.2
2014,"Mobile City (West) PUMA","79500US0102702","Computer programmers","151131",56580.1,11125.5
2014,"Prichard City, Tillmans Corner & Saraland City PUMA, AL","79500US0102703","Computer programmers","151131",55443.1,9506.04
2014,"Anchorage Municipality (South) PUMA, AK","79500US0200102","Computer programmers","151131",91946.1,5394.03
2014,"Greater Fairbanks, Greater Juneau, Ketchikan Gateway Borough & Road-Connected Alaska PUMA, AK","79500US0200300","Computer programmers","151131",89711.8,23404.3
2014,"Maricopa County--Gilbert (South) & Queen Creek Towns PUMA","79500US0400100","Computer programmers","151131",78865.4,10529.8
2014,"Mesa City (East) PUMA, AZ","79500US0400101","Computer programmers","151131",58429.3,22225.9
2014,"Maricopa County--Mesa City (North Central) PUMA","79500US0400102","Computer programmers","151131",69193.1,20350.0
2014,"Maricopa County--Mesa City (West) PUMA","79500US0400103","Computer programmers","151131",105449.0,33391.8
2014,"Gilbert Town (North) PUMA, AZ","79500US0400105","Computer programmers","151131",55912.9,35849.5
2014,"Maricopa County--Chandler City (Northeast) PUMA","79500US0400106","Computer programmers","151131",74148.4,11919.7
2014,"Maricopa County--Chandler City (South) PUMA","79500US0400107","Computer programmers","151131",84697.2,14714.6
2014,"Tempe (South) & Chandler (Northwest) Cities PUMA, AZ","79500US0400108","Computer programmers","151131",81078.9,12469.7
2014,"Tempe City (North) PUMA, AZ","79500US0400109","Computer programmers","151131",50757.3,19922.3
2014,"Maricopa County--Scottsdale City (Southwest) & Paradise Valley Town PUMA","79500US0400110","Computer programmers","151131",49921.5,14917.1
2014,"Maricopa County (Northeast)--Scottsdale City (Southeast) & Fountain Hills Town PUMA","79500US0400111","Computer programmers","151131",86537.9,8336.37
2014,"Maricopa County--Scottsdale (North), Phoenix (Far Northeast) Cities & Cave Creek PUMA","79500US0400112","Computer programmers","151131",142025.0,52515.5
2014,"Phoenix City (Northeast) PUMA","79500US0400113","Computer programmers","151131",71809.1,16450.8
2014,"Phoenix City (Northeast Central) PUMA","79500US0400114","Computer programmers","151131",77346.6,12312.9
2014,"Phoenix City (Northwest Central) PUMA","79500US0400115","Computer programmers","151131",63773.9,11207.1
2014,"Phoenix City (Uptown) PUMA","79500US0400116","Computer programmers","151131",64332.7,15268.3
2014,"Phoenix City (East) PUMA","79500US0400117","Computer programmers","151131",75799.6,41501.8
2014,"Phoenix City--Downtown & Sky Harbor International Airport PUMA","79500US0400118","Computer programmers","151131",72992.6,17483.2
2014,"Phoenix City (South) PUMA","79500US0400119","Computer programmers","151131",42672.0,11442.7
2014,"Phoenix City--Ahwatukee & South Mountain PUMA","79500US0400120","Computer programmers","151131",95688.1,12873.8
2014,"Phoenix City (West) PUMA","79500US0400125","Computer programmers","151131",58162.7,9864.98
2014,"Maricopa County--Glendale City (North) PUMA","79500US0400126","Computer programmers","151131",71770.1,7400.2
2014,"Phoenix City (North) PUMA","79500US0400128","Computer programmers","151131",76038.0,11107.9
2014,"Phoenix (Far North) & Peoria (Northwest) Cities PUMA","79500US0400129","Computer programmers","151131",56685.1,20972.1
2014,"Maricopa County--Avondale (Central) & Litchfield Park (Central) Cities PUMA","79500US0400133","Computer programmers","151131",94217.2,15173.5
2014,"Tucson (West) & Marana Cities PUMA","79500US0400202","Computer programmers","151131",89762.9,18208.4
2014,"Pima County (Northeast) PUMA","79500US0400204","Computer programmers","151131",91950.3,23939.7
2014,"Tucson City (Northeast) PUMA","79500US0400206","Computer programmers","151131",68150.7,23415.6
2014,"Tucson City (Northwest) PUMA","79500US0400207","Computer programmers","151131",69533.5,21185.1
2014,"Tucson City (Southeast) PUMA","79500US0400209","Computer programmers","151131",62907.5,25574.3
2014,"Pinal County (North)--Apache Junction City PUMA","79500US0400803","Computer programmers","151131",60717.6,20430.8
2014,"Pinal County (West)--Maricopa, Casa Grande & Eloy (Southeast) Cities PUMA","79500US0400807","Computer programmers","151131",63043.6,9214.76
2014,"Benton County PUMA, AR","79500US0500100","Computer programmers","151131",73320.7,8307.25
2014,"Washington County PUMA, AR","79500US0500200","Computer programmers","151131",72311.4,16269.1
2014,"Baxter, Boone, Carroll, Marion, Madison, Newton & Searcy Counties PUMA, AR","79500US0500300","Computer programmers","151131",98105.2,15387.4
2014,"North Little Rock, Sherwood & Jacksonville Cities PUMA, AR","79500US0500900","Computer programmers","151131",61900.2,7299.84
2014,"Little Rock City PUMA, AR","79500US0501000","Computer programmers","151131",51674.4,17131.7
2014,"Faulkner & Lonoke Counties PUMA, AR","79500US0501100","Computer programmers","151131",56995.4,14490.1
2014,"Saline County PUMA","79500US0501200","Computer programmers","151131",73277.2,10552.2
2014,"Pope, Johnson, Yell, Conway & Perry Counties PUMA, AR","79500US0501300","Computer programmers","151131",47339.5,19094.9
2014,"Sebastian & Crawford Counties PUMA, AR","79500US0501400","Computer programmers","151131",59448.8,14080.3
2014,"South Central Arkansas PUMA","79500US0501900","Computer programmers","151131",41067.6,13593.4
2014,"Berkeley & Albany Cities PUMA, CA","79500US0600101","Computer programmers","151131",66441.9,16683.4
2014,"Oakland (Northwest) & Emeryville Cities PUMA, CA","79500US0600102","Computer programmers","151131",75074.4,24334.1
2014,"Alameda County (Northeast)--Oakland (East) & Piedmont Cities PUMA","79500US0600103","Computer programmers","151131",106547.0,20124.2
2014,"San Leandro, Alameda & Oakland (Southwest) Cities PUMA, CA","79500US0600105","Computer programmers","151131",95795.2,18554.3
2014,"Castro Valley, San Lorenzo & Ashland PUMA, CA","79500US0600106","Computer programmers","151131",75169.7,18842.6
2014,"Hayward City PUMA, CA","79500US0600107","Computer programmers","151131",78418.5,19656.7
2014,"Union City, Newark & Fremont (West) Cities PUMA, CA","79500US0600108","Computer programmers","151131",95735.6,17816.3
2014,"Fremont City (East) PUMA, CA","79500US0600109","Computer programmers","151131",110195.0,8345.64
2014,"Livermore, Pleasanton & Dublin Cities PUMA, CA","79500US0600110","Computer programmers","151131",108655.0,11931.4
2014,"Butte County (Northwest)--Chico City PUMA","79500US0600701","Computer programmers","151131",59019.9,20308.4
2014,"Contra Costa County (Far Southwest)--Richmond (Southwest) & San Pablo Cities PUMA","79500US0601301","Computer programmers","151131",82804.1,25457.2
2014,"Contra Costa County (Far Northwest)--Richmond (North), Hercules & El Cerrito Cites PUMA","79500US0601302","Computer programmers","151131",100219.0,18725.7
2014,"Contra Costa County (Northwest)--Concord (West), Martinez & Pleasant Hill Cities PUMA","79500US0601303","Computer programmers","151131",72670.3,21085.8
2014,"Contra Costa County--Walnut Creek (West), Lafayette, Orinda Cities & Moraga Town PUMA","79500US0601304","Computer programmers","151131",107650.0,23688.1
2014,"Contra Costa County (South)--San Ramon City & Danville Town PUMA","79500US0601305","Computer programmers","151131",110404.0,21567.1
2014,"Contra Costa County (Central)--Concord (South), Walnut Creek (East) & Clayton Cities PUMA","79500US0601306","Computer programmers","151131",107393.0,24471.5
2014,"Contra Costa County (North Central)--Pittsburg & Concord (North & East) Cities PUMA","79500US0601307","Computer programmers","151131",97658.0,33533.9
2014,"Contra Costa County (Northeast)--Antioch City PUMA","79500US0601308","Computer programmers","151131",93730.1,16176.7
2014,"Contra Costa County (East)--Brentwood & Oakley Cities PUMA","79500US0601309","Computer programmers","151131",95079.6,13640.0
2014,"El Dorado Hills PUMA, CA","79500US0601700","Computer programmers","151131",97436.0,7979.79
2014,"Fresno City (North) PUMA, CA","79500US0601902","Computer programmers","151131",76807.2,25421.1
2014,"Bakersfield City (West) PUMA, CA","79500US0602902","Computer programmers","151131",72807.7,23646.7
2014,"Ridgecrest, Arvin, Tehachapi & California City Cities PUMA, CA","79500US0602905","Computer programmers","151131",84261.2,16022.0
2014,"Castaic PUMA, CA","79500US0603701","Computer programmers","151131",91464.5,12545.9
2014,"Santa Clarita City PUMA, CA","79500US0603702","Computer programmers","151131",87798.3,15235.8
2014,"Palmdale City PUMA, CA","79500US0603704","Computer programmers","151131",54485.9,13205.9
2014,"LA City (Northwest/Chatsworth & Porter Ranch) PUMA, CA","79500US0603705","Computer programmers","151131",118395.0,42201.0
2014,"LA City (North Central/Granada Hills & Sylmar) PUMA, CA","79500US0603706","Computer programmers","151131",67061.3,18507.3
2014,"LA City (Northeast/Sunland, Sun Valley & Tujunga) PUMA, CA","79500US0603708","Computer programmers","151131",81659.9,21300.9
2014,"Los Angeles County (Central)--San Gabriel Valley Region (North) PUMA","79500US0603709","Computer programmers","151131",65965.3,19207.7
2014,"Baldwin Park, Azusa, Duarte & Irwindale Cities PUMA, CA","79500US0603710","Computer programmers","151131",52745.2,21857.9
2014,"Glendora, Claremont, San Dimas & La Verne Cities PUMA, CA","79500US0603711","Computer programmers","151131",66680.1,25986.1
2014,"Pomona City PUMA, CA","79500US0603712","Computer programmers","151131",62033.3,17762.2
2014,"Los Angeles County (East Central)--Covina & Walnut Cities PUMA","79500US0603713","Computer programmers","151131",90346.5,17319.6
2014,"Los Angeles County--Diamond Bar, La Habra Heights (East) Cities & Rowland Heights PUMA","79500US0603714","Computer programmers","151131",97958.8,22539.3
2014,"Arcadia, San Gabriel & Temple City Cities PUMA, CA","79500US0603717","Computer programmers","151131",83386.2,27989.8
2014,"Pasadena City PUMA, CA","79500US0603718","Computer programmers","151131",71947.7,25742.5
2014,"Glendale City PUMA, CA","79500US0603719","Computer programmers","151131",55789.9,14091.8
2014,"Los Angeles County (Central)--Burbank City PUMA","79500US0603720","Computer programmers","151131",66164.5,12128.5
2014,"LA City (Northeast/North Hollywood & Valley Village) PUMA, CA","79500US0603721","Computer programmers","151131",68015.4,15612.8
2014,"LA City (North Central/Van Nuys & North Sherman Oaks) PUMA, CA","79500US0603722","Computer programmers","151131",74048.5,29845.9
2014,"LA City (Northwest/Encino & Tarzana) PUMA, CA","79500US0603724","Computer programmers","151131",66162.1,22554.6
2014,"LA City (Northwest/Canoga Park, Winnetka & Woodland Hills) PUMA, CA","79500US0603725","Computer programmers","151131",93950.8,34050.5
2014,"Los Angeles County--Calabasas, Agoura Hills, Malibu & Westlake Village Cities PUMA","79500US0603726","Computer programmers","151131",89763.6,37284.9
2014,"LA City (Central/Pacific Palisades) PUMA, CA","79500US0603727","Computer programmers","151131",121312.0,40843.9
2014,"Santa Monica City PUMA, CA","79500US0603728","Computer programmers","151131",110079.0,43490.2
2014,"LA City (West Central/Westwood & West Los Angeles) PUMA, CA","79500US0603729","Computer programmers","151131",68335.0,14576.0
2014,"LA City (Central/Hancock Park & Mid-Wilshire) PUMA, CA","79500US0603730","Computer programmers","151131",75924.5,27130.2
2014,"LA City (East Central/Silver Lake, Echo Park & Westlake) PUMA, CA","79500US0603734","Computer programmers","151131",72611.6,30016.0
2014,"LA City (Mount Washington, Highland Park & Glassell Park) PUMA, CA","79500US0603735","Computer programmers","151131",71848.1,24755.1
2014,"Los Angeles County (Central)--Alhambra & South Pasadena Cities PUMA","79500US0603736","Computer programmers","151131",66632.1,21908.2
2014,"Los Angeles County (Central)--Monterey Park & Rosemead Cities PUMA","79500US0603737","Computer programmers","151131",82706.9,14280.2
2014,"Los Angeles County (Central)--El Monte & South El Monte Cities PUMA","79500US0603738","Computer programmers","151131",61302.4,27106.3
2014,"Whittier City & Hacienda Heights PUMA, CA","79500US0603739","Computer programmers","151131",96233.1,10819.7
2014,"Los Angeles County--LA City (Central/Univ. of Southern California & Exposition Park) PUMA","79500US0603746","Computer programmers","151131",12379.8,6183.73
2014,"LA (Southwest/Marina del Rey & Westchester) & Culver City Cities PUMA, CA","79500US0603748","Computer programmers","151131",80625.4,20082.0
2014,"Gardena, Lawndale Cities & West Athens PUMA, CA","79500US0603758","Computer programmers","151131",64160.8,27886.1
2014,"Los Angeles County (South Central)--Hawthorne City PUMA","79500US0603759","Computer programmers","151131",102372.0,47109.7
2014,"Redondo Beach, Manhattan Beach & Hermosa Beach Cities PUMA, CA","79500US0603760","Computer programmers","151131",58308.2,16657.1
2014,"Los Angeles County (South Central)--Torrance City PUMA","79500US0603761","Computer programmers","151131",85069.5,24194.2
2014,"Los Angeles County (South Central)--Carson City PUMA","79500US0603762","Computer programmers","151131",66303.9,24383.6
2014,"Lakewood, Cerritos, Artesia & Hawaiian Gardens Cities PUMA, CA","79500US0603764","Computer programmers","151131",94506.2,34716.4
2014,"Los Angeles County (Southeast)--Long Beach City (East) PUMA","79500US0603765","Computer programmers","151131",60056.8,29780.7
2014,"LA City (South/San Pedro) PUMA, CA","79500US0603767","Computer programmers","151131",127207.0,43170.5
2014,"Los Angeles County (Southwest)--Palos Verdes Peninsula PUMA","79500US0603768","Computer programmers","151131",121347.0,27444.4
2014,"Los Angeles County (Southeast)--Long Beach (Central) & Signal Hill Cities PUMA","79500US0603769","Computer programmers","151131",63488.1,19520.7
2014,"Madera City PUMA, CA","79500US0603900","Computer programmers","151131",128722.0,64767.3
2014,"Marin County (North & West)--Novato & San Rafael (North) Cities PUMA","79500US0604101","Computer programmers","151131",116189.0,45578.7
2014,"San Rafael (South), Mill Valley & Sausalito Cities PUMA, CA","79500US0604102","Computer programmers","151131",79811.2,36169.2
2014,"Seaside, Monterey, Marina & Pacific Grove Cities PUMA, CA","79500US0605301","Computer programmers","151131",63278.9,15625.7
2014,"Monterey (South & East) & San Benito Counties PUMA, CA","79500US0605303","Computer programmers","151131",93884.8,22007.7
2014,"Napa City PUMA, CA","79500US0605500","Computer programmers","151131",103406.0,18573.0
2014,"San Clemente, Laguna Niguel & San Juan Capistrano Cities PUMA, CA","79500US0605901","Computer programmers","151131",69767.1,35847.3
2014,"Orange County (South Central)--Mission Viejo & Rancho Santa Margarita (West) Cities PUMA","79500US0605902","Computer programmers","151131",102416.0,11970.2
2014,"Newport Beach, Aliso Viejo & Laguna Hills Cities PUMA, CA","79500US0605903","Computer programmers","151131",98271.0,27310.9
2014,"Irvine City (Central) PUMA, CA","79500US0605904","Computer programmers","151131",86951.2,11132.6
2014,"Lake Forest, Irvine (North) Cities & Silverado PUMA, CA","79500US0605905","Computer programmers","151131",87057.9,14734.6
2014,"Yorba Linda, La Habra & Brea Cities PUMA, CA","79500US0605906","Computer programmers","151131",91386.3,13313.3
2014,"Fullerton & Placentia Cities PUMA, CA","79500US0605907","Computer programmers","151131",71085.8,15069.1
2014,"Buena Park, Cypress & Seal Beach Cities PUMA, CA","79500US0605908","Computer programmers","151131",84076.7,13931.5
2014,"Anaheim City (West) PUMA, CA","79500US0605909","Computer programmers","151131",63275.0,10633.2
2014,"Anaheim City (East) PUMA, CA","79500US0605910","Computer programmers","151131",91873.9,12307.1
2014,"Orange & Villa Park Cities PUMA, CA","79500US0605911","Computer programmers","151131",128791.0,72994.8
2014,"Westminster, Stanton & Garden Grove (West) Cities PUMA, CA","79500US0605912","Computer programmers","151131",54601.2,17352.7
2014,"Garden Grove City (East) PUMA, CA","79500US0605913","Computer programmers","151131",64649.3,9959.53
2014,"Huntington Beach City PUMA, CA","79500US0605914","Computer programmers","151131",98519.4,11222.7
2014,"Orange County (Southeast)--Rancho Santa Margarita City (East) & Ladera Ranch PUMA","79500US0605915","Computer programmers","151131",103908.0,20428.2
2014,"Santa Ana City (West) PUMA, CA","79500US0605916","Computer programmers","151131",63977.7,16374.7
2014,"Santa Ana City (East) PUMA, CA","79500US0605917","Computer programmers","151131",65189.2,15870.5
2014,"Costa Mesa & Fountain Valley Cities PUMA, CA","79500US0605918","Computer programmers","151131",101043.0,21148.5
2014,"Placer County (Southwest)--Roseville City PUMA","79500US0606101","Computer programmers","151131",72879.5,9517.0
2014,"Placer County (Central)--Rocklin, Lincoln Cities & Loomis Town PUMA","79500US0606102","Computer programmers","151131",98465.5,26890.3
2014,"Placer County (East/High Country Region)--Auburn & Colfax Cities PUMA","79500US0606103","Computer programmers","151131",81766.5,21270.3
2014,"Riverside County (Central)--Cathedral City, Palm Springs & Rancho Mirage Cities PUMA","79500US0606502","Computer programmers","151131",112762.0,43103.2
2014,"Riverside County (Southwest)--Temecula City PUMA","79500US0606503","Computer programmers","151131",134096.0,44071.2
2014,"Menifee, Lake Elsinore & Canyon Lake Cities PUMA, CA","79500US0606505","Computer programmers","151131",73197.2,13354.7
2014,"Hemet City & East Hemet PUMA, CA","79500US0606506","Computer programmers","151131",87752.9,30194.9
2014,"Riverside City (East) PUMA, CA","79500US0606510","Computer programmers","151131",76004.0,21461.1
2014,"Riverside City (West) PUMA, CA","79500US0606511","Computer programmers","151131",65917.3,22841.7
2014,"Corona (Northwest) & Norco Cities PUMA, CA","79500US0606513","Computer programmers","151131",83640.6,21979.1
2014,"Jurupa Valley & Eastvale Cities PUMA, CA","79500US0606514","Computer programmers","151131",53434.7,18383.6
2014,"Sacramento County (North Central)--Citrus Heights City PUMA","79500US0606701","Computer programmers","151131",72303.5,13593.2
2014,"Sacramento County (Central)--Rancho Cordova City PUMA","79500US0606702","Computer programmers","151131",91485.5,45820.4
2014,"Sacramento County (North Central)--Arden-Arcade, Carmichael & Fair Oaks (West) PUMA","79500US0606703","Computer programmers","151131",77875.0,14457.4
2014,"Sacramento County (North Central)--North Highlands, Foothill Farms & McClellan Park PUMA","79500US0606704","Computer programmers","151131",57031.6,21371.0
2014,"Sacramento County (Northwest)--Sacramento City (Northwest/Natomas) PUMA","79500US0606705","Computer programmers","151131",84953.9,20422.6
2014,"Sacramento County (West)--Sacramento City (Central/Downtown & Midtown) PUMA","79500US0606707","Computer programmers","151131",76031.1,17470.5
2014,"Sacramento City (Southeast/Fruitridge, Avondale & Depot Park) PUMA, CA","79500US0606708","Computer programmers","151131",68517.1,28192.2
2014,"Sacramento City (Southwest/Pocket, Meadowview & North Laguna) PUMA, CA","79500US0606709","Computer programmers","151131",65429.9,13308.6
2014,"Elk Grove City PUMA, CA","79500US0606710","Computer programmers","151131",78901.9,7549.02
2014,"Sacramento County (South)--Galt, Isleton Cities & Delta Region PUMA","79500US0606711","Computer programmers","151131",58711.8,22322.9
2014,"Sacramento County (Northeast)--Folsom City, Orangevale & Fair Oaks (East) PUMA","79500US0606712","Computer programmers","151131",78720.7,13258.3
2014,"Hesperia City & Apple Valley Town PUMA, CA","79500US0607103","Computer programmers","151131",66333.9,17919.8
2014,"Redlands & Yucaipa Cities PUMA, CA","79500US0607105","Computer programmers","151131",95412.4,21293.3
2014,"Ontario City PUMA, CA","79500US0607113","Computer programmers","151131",64595.1,23125.9
2014,"Chino & Chino Hills Cities PUMA, CA","79500US0607114","Computer programmers","151131",96425.4,9911.96
2014,"Oceanside City & Camp Pendleton PUMA, CA","79500US0607301","Computer programmers","151131",85142.9,27302.6
2014,"San Diego County (North & East)--Fallbrook, Alpine & Valley Center PUMA","79500US0607302","Computer programmers","151131",91520.9,15581.0
2014,"San Diego County (Northwest)--Vista City PUMA","79500US0607303","Computer programmers","151131",54677.3,28012.4
2014,"San Diego County (Northwest)--Carlsbad City PUMA","79500US0607304","Computer programmers","151131",116137.0,38989.9
2014,"San Diego County (Northwest)--San Marcos & Escondido (West) Cities PUMA","79500US0607305","Computer programmers","151131",83643.4,23562.2
2014,"Escondido City (East) PUMA, CA","79500US0607306","Computer programmers","151131",101843.0,48266.4
2014,"San Diego County (Central)--Lakeside, Winter Gardens & Ramona PUMA","79500US0607307","Computer programmers","151131",50300.9,37253.6
2014,"San Diego County (Central)--San Diego (Northeast/Rancho Bernardo) & Poway Cities PUMA","79500US0607308","Computer programmers","151131",90002.2,13026.4
2014,"San Diego (Northwest/San Dieguito) & Encinitas Cities PUMA, CA","79500US0607309","Computer programmers","151131",88139.6,13683.8
2014,"San Diego City (Southwest/Central Coastal) PUMA, CA","79500US0607310","Computer programmers","151131",77960.2,17055.3
2014,"San Diego County (West Central)--San Diego City (Northwest/Del Mar Mesa) PUMA","79500US0607311","Computer programmers","151131",101523.0,22968.9
2014,"San Diego County (Central)--San Diego City (Central/Mira Mesa & University Heights) PUMA","79500US0607312","Computer programmers","151131",72482.2,18137.8
2014,"El Cajon & Santee Cities PUMA, CA","79500US0607313","Computer programmers","151131",114268.0,41607.2
2014,"San Diego (East Central/Navajo) & La Mesa Cities PUMA, CA","79500US0607314","Computer programmers","151131",82238.4,25762.5
2014,"San Diego City (Central/Clairemont & Kearny Mesa) PUMA, CA","79500US0607315","Computer programmers","151131",69714.8,13094.2
2014,"San Diego City (Central/Mid-City) PUMA, CA","79500US0607317","Computer programmers","151131",62866.9,21894.2
2014,"Lemon Grove City, La Presa & Spring Valley PUMA, CA","79500US0607319","Computer programmers","151131",66001.5,32460.6
2014,"Sweetwater Region--Chula Vista City (East) PUMA, CA","79500US0607320","Computer programmers","151131",98682.3,14379.0
2014,"Chula Vista (West) & National City Cities PUMA, CA","79500US0607321","Computer programmers","151131",66005.9,12828.4
2014,"Richmond District PUMA, CA","79500US0607501","Computer programmers","151131",94233.1,9894.61
2014,"San Francisco County (North & East)--North Beach & Chinatown PUMA","79500US0607502","Computer programmers","151131",72930.9,25693.4
2014,"San Francisco County (Central)--South of Market & Potrero PUMA","79500US0607503","Computer programmers","151131",110062.0,23718.6
2014,"San Francisco County (Central)--Inner Mission & Castro PUMA","79500US0607504","Computer programmers","151131",125965.0,26540.4
2014,"San Francisco County (Central)--Sunset District (North) PUMA","79500US0607505","Computer programmers","151131",103427.0,23386.8
2014,"San Francisco County (South Central)--Sunset District (South) PUMA","79500US0607506","Computer programmers","151131",95963.9,23633.2
2014,"San Francisco County (South Central)--Bayview & Hunters Point PUMA","79500US0607507","Computer programmers","151131",70076.7,18807.9
2014,"Stockton City (South) PUMA, CA","79500US0607702","Computer programmers","151131",63227.2,8608.67
2014,"Tracy, Manteca & Lathrop Cities PUMA, CA","79500US0607703","Computer programmers","151131",101410.0,14607.1
2014,"Coastal Region PUMA, CA","79500US0607901","Computer programmers","151131",66023.2,25646.3
2014,"Daly City, Pacifica Cities & Colma Town PUMA, CA","79500US0608101","Computer programmers","151131",111764.0,16410.5
2014,"South San Francisco, San Bruno & Brisbane Cities PUMA, CA","79500US0608102","Computer programmers","151131",163679.0,69636.5
